{"$schema":"http://json-schema.org/draft-07/schema#","$id":"https://agentic-website-studio.local/schemas/project-lessons.schema.json","type":"object","additionalProperties":false,"required":["schemaVersion","documentId","pilotId","lessons","candidateRules","promotionPolicy","reusabilityAudit","pilot2Readiness"],"properties":{"schemaVersion":{"const":"1.0.0"},"documentId":{"type":"string"},"pilotId":{"const":"wayfinder"},"lessons":{"type":"array","minItems":1,"items":{"type":"object","additionalProperties":false,"required":["lessonId","observation","evidence","outcome","confidence","scope","humanEvidence","machineEvidence"],"properties":{"lessonId":{"type":"string"},"observation":{"type":"string"},"evidence":{"type":"array","minItems":1,"items":{"type":"string"}},"outcome":{"type":"string"},"confidence":{"enum":["high","medium","limited"]},"scope":{"type":"string"},"humanEvidence":{"type":"boolean"},"machineEvidence":{"type":"boolean"}}}},"candidateRules":{"type":"array","minItems":1,"items":{"type":"object","additionalProperties":false,"required":["ruleId","proposedRule","supportingPilots","supportingHumanEvidence","supportingMachineEvidence","limitations","confidence","promotionRequirement"],"properties":{"ruleId":{"type":"string"},"proposedRule":{"type":"string"},"supportingPilots":{"type":"array","minItems":1,"items":{"const":"wayfinder"}},"supportingHumanEvidence":{"type":"array","minItems":1,"items":{"type":"string"}},"supportingMachineEvidence":{"type":"array","minItems":1,"items":{"type":"string"}},"limitations":{"type":"array","minItems":1,"items":{"type":"string"}},"confidence":{"enum":["high","medium","limited"]},"promotionRequirement":{"type":"string"}}}},"promotionPolicy":{"type":"object","additionalProperties":false,"required":["principle","requirements"],"properties":{"principle":{"const":"Evidence before self-improvement."},"requirements":{"type":"array","minItems":3,"items":{"type":"string"}}}},"reusabilityAudit":{"type":"object","additionalProperties":false,"required":["reusableNow","candidateReusable","wayfinderSpecific"],"properties":{"reusableNow":{"type":"array","items":{"type":"string"}},"candidateReusable":{"type":"array","items":{"type":"string"}},"wayfinderSpecific":{"type":"array","items":{"type":"string"}}}},"pilot2Readiness":{"type":"object","additionalProperties":false,"required":["status","requirements"],"properties":{"status":{"const":"readiness_only_no_pilot_selected_or_implemented"},"requirements":{"type":"array","minItems":5,"items":{"type":"string"}}}}}}
