{
  "schemaVersion":"1.0.0",
  "documentId":"wayfinder_project_lessons_01",
  "pilotId":"wayfinder",
  "lessons":[
    {"lessonId":"WL-01","observation":"Structural branch differentiation alone did not create felt agency or perceived consequence in the first slice.","evidence":["docs/wayfinder.m42-human-playtest-feedback.json","docs/wayfinder.m4-qa-report.json"],"outcome":"Human Gate requested revision despite passing machine QA.","confidence":"high","scope":"Interactive narrative slices with stateful choices.","humanEvidence":true,"machineEvidence":true},
    {"lessonId":"WL-02","observation":"Active observation, persistent world state, and a pre-reflection enacted consequence improved immersion, agency, consequence, and pacing in the revised slice.","evidence":["docs/wayfinder.m42r-human-replaytest-decision.json","docs/wayfinder.m42r-revision-contract.json"],"outcome":"Human Re-Playtest approved expansion, while narrative tone remained unevaluated.","confidence":"high","scope":"The Wayfinder slice revision; not a universal interaction claim.","humanEvidence":true,"machineEvidence":true},
    {"lessonId":"WL-03","observation":"Repeated three-way interaction structure was perceived as act sameness even when content and state differed.","evidence":["docs/wayfinder.m43-human-expansion-feedback.json","docs/wayfinder.m43r-revision-contract.json"],"outcome":"M4.3 feedback requested revision; M4.3R introduced three distinct primitives.","confidence":"high","scope":"Multi-act interactive narrative design.","humanEvidence":true,"machineEvidence":true},
    {"lessonId":"WL-04","observation":"Choice Memory became perceptible and was explicitly preserved through later revisions.","evidence":["docs/wayfinder.m43-human-expansion-feedback.json","docs/wayfinder.m43r-qa-report.json"],"outcome":"M4.3 human feedback passed Choice Memory; M4.3R machine evidence retained ordered histories and later conditioning.","confidence":"high","scope":"Wayfinder's authored memory model.","humanEvidence":true,"machineEvidence":true},
    {"lessonId":"WL-05","observation":"Correct state history alone was insufficient for a felt journey; scene progression and narrative motion mattered separately.","evidence":["docs/wayfinder.m43-human-expansion-feedback.json","docs/wayfinder.m43r-independent-revision-audit.json"],"outcome":"The prior experience was judged too short with insufficient scene change and motion; the revision added continuous regions and semantic travel motion, but the final human replay questions remain unanswered.","confidence":"high","scope":"Wayfinder; final subjective effect remains unvalidated.","humanEvidence":true,"machineEvidence":true},
    {"lessonId":"WL-06","observation":"Agent-generated improvements required repeated Human Gate validation rather than inferred approval from automated checks.","evidence":["docs/wayfinder.m4-human-playtest-gate.json","docs/wayfinder.m42r-human-replaytest-gate.json","docs/wayfinder.m43r-human-expansion-replaytest-gate.json"],"outcome":"A passing machine chain never approved the experience or release; the final replaytest remains historically pending at closure.","confidence":"high","scope":"Studio methodology.","humanEvidence":true,"machineEvidence":true}
  ],
  "candidateRules":[
    {"ruleId":"CR-01","proposedRule":"For interactive narrative work, automated branch-state differentiation must not substitute for a Human Gate testing felt consequence before explanatory text.","supportingPilots":["wayfinder"],"supportingHumanEvidence":["M4.2 Human Playtest rejected perceived consequence and felt agency."],"supportingMachineEvidence":["M4.2 QA passed deterministic branch differences."],"limitations":["One pilot and one interaction genre; no cross-context replication."],"confidence":"high","promotionRequirement":"Successful evidence from one materially different later pilot, explicit human validation with strong cross-context rationale, or controlled comparative evidence."},
    {"ruleId":"CR-02","proposedRule":"When major decisions share an interaction primitive, test perceived act differentiation before expanding content volume.","supportingPilots":["wayfinder"],"supportingHumanEvidence":["M4.3 feedback described three decisions as only different materials."],"supportingMachineEvidence":["M4.3R encoded and tested three distinct semantic primitives."],"limitations":["M4.3R's final subjective differentiation was not replaytested before closure."],"confidence":"medium","promotionRequirement":"Successful evidence from one materially different later pilot, explicit human validation with strong cross-context rationale, or controlled comparative evidence."},
    {"ruleId":"CR-03","proposedRule":"Treat human evaluation as a repeated validation gate after material agent-authored interaction changes; passing technical QA is necessary but not an experience verdict.","supportingPilots":["wayfinder"],"supportingHumanEvidence":["M4.2 requested revision; M4.2R approved expansion; M4.3 requested revision."],"supportingMachineEvidence":["Each stage retained separate deterministic QA and provenance artifacts."],"limitations":["The cadence and questions need adaptation for different product types."],"confidence":"high","promotionRequirement":"Successful evidence from one materially different later pilot, explicit human validation with strong cross-context rationale, or controlled comparative evidence."}
  ],
  "promotionPolicy":{"principle":"Evidence before self-improvement.","requirements":["Successful evidence from at least one materially different later Pilot.","Or explicit human validation plus a strong cross-context rationale.","Or controlled comparative evidence."]},
  "reusabilityAudit":{"reusableNow":["Evidence and provenance contracts.","Rights handling and source-neutral originality firewall.","Human Gate provenance and machine-QA versus human-evaluation separation."],"candidateReusable":["Candidate Rules CR-01 through CR-03.","History-aware experience validation patterns, pending replication outside interactive narrative."],"wayfinderSpecific":["Three Bearings world, copy, SVG composition, route/tradeoff content, and its state machine.","Wayfinder's exact 27-history test matrix and M4.3R replaytest questions."]},
  "pilot2Readiness":{"status":"readiness_only_no_pilot_selected_or_implemented","requirements":["Choose a materially different primary user goal.","Use a different primary interaction primitive.","Use a different information architecture.","Address a different visual problem.","Prefer different technical rendering needs.","Retain the Reference to Evidence to Synthesis to Human Gate methodology.","Record why the pilot is materially different before implementation."]}
}
